{
  "registry_version": "0.1.0",
  "status": "seed",
  "patterns": [
    {
      "id": "ai_agent_workflow_system",
      "label": "AI agent workflow system",
      "description": "Agents, skills, prompts, tools, governance, and handoffs that work together as a repeatable AI workflow.",
      "leverage": "very_high",
      "recognition_mode": "repository_composite",
      "positive_signals": [
        "agent or skill assets",
        "workflow or orchestration assets",
        "preflight/postflight/handoff evidence",
        "govern_agents or capture_lessons capability"
      ],
      "missing_evidence": [
        "successful run evidence",
        "before/after asset-use feedback",
        "failure modes and escalation path"
      ]
    },
    {
      "id": "evaluation_contract_system",
      "label": "Evaluation and contract system",
      "description": "Tests, evaluations, schemas, golden cases, and validators that prove behavior and keep agents aligned.",
      "leverage": "very_high",
      "recognition_mode": "repository_composite",
      "positive_signals": [
        "test or evaluation assets",
        "schema or ontology assets",
        "validate_contracts capability",
        "golden cases or regression language"
      ],
      "missing_evidence": [
        "human labels",
        "precision/recall or failure-case coverage",
        "current validation command results"
      ]
    },
    {
      "id": "knowledge_graph_retrieval_system",
      "label": "Knowledge graph and retrieval system",
      "description": "Ontology, taxonomy, graph, retrieval, context-pack, and index assets that help agents find and connect the right things.",
      "leverage": "very_high",
      "recognition_mode": "repository_composite",
      "positive_signals": [
        "ontology or taxonomy assets",
        "knowledge-graph tags",
        "retrieval tags",
        "build_knowledge_graph or retrieve_context capability"
      ],
      "missing_evidence": [
        "query evaluation",
        "retrieval quality labels",
        "graph edge false-positive review"
      ]
    },
    {
      "id": "governed_learning_loop_system",
      "label": "Governed learning loop system",
      "description": "Lessons, handoffs, asset-use feedback, governance gates, and review loops that improve future agent behavior.",
      "leverage": "very_high",
      "recognition_mode": "repository_composite",
      "positive_signals": [
        "lesson or workflow assets",
        "learning-loop tags",
        "governance tags",
        "capture_lessons capability"
      ],
      "missing_evidence": [
        "repeated feedback records",
        "reviewed promotion decisions",
        "postflight compliance evidence"
      ]
    },
    {
      "id": "asset_use_pay_forward_loop",
      "label": "Asset-use pay-forward loop",
      "description": "A before-use and after-use workflow that records how any digital asset was found, used, upgraded, blocked, valued, and safely handed forward to future agents.",
      "leverage": "very_high",
      "recognition_mode": "repository_composite",
      "positive_signals": [
        "DAD_ASSET_USE_FEEDBACK_V1 marker",
        "before-use expectation and after-use result fields",
        "parts used, parts not used, difficulties, and upgrades",
        "reuse-when, avoid-when, pay-forward, and next-agent-action guidance",
        "candidate-only safety boundary for external or repo-local feedback"
      ],
      "missing_evidence": [
        "paired before-use and after-use records for the same asset",
        "reviewed examples across multiple asset types",
        "calibrated impact on current score and ceiling ranges",
        "curated rejection examples showing unsafe or unhelpful feedback"
      ]
    },
    {
      "id": "route_isolated_evaluation_harness",
      "label": "Route-isolated evaluation harness",
      "description": "Routing, chunking, form classification, context packets, scorecards, and gold cases that evaluate different asset forms without mixing authority boundaries.",
      "leverage": "very_high",
      "recognition_mode": "repository_composite",
      "positive_signals": [
        "route or form classification assets",
        "chunk or context-packet assets",
        "evaluation or scorecard assets",
        "gold cases or review packets"
      ],
      "missing_evidence": [
        "route-level precision and recall",
        "human-labeled gold set",
        "contamination and fallback tests"
      ]
    },
    {
      "id": "agent_skill_graph_system",
      "label": "Agent and skill graph system",
      "description": "Agents, skills, capability registries, tool routes, handoffs, and graph relationships that let future agents discover and compose the right capabilities.",
      "leverage": "very_high",
      "recognition_mode": "repository_composite",
      "positive_signals": [
        "agent or skill assets",
        "capability or tool registry",
        "handoff or orchestration workflow",
        "knowledge-graph edges between capabilities"
      ],
      "missing_evidence": [
        "actual agent-use feedback",
        "capability conflict rules",
        "evaluation of discovery quality"
      ]
    },
    {
      "id": "boundary_contamination_firewall",
      "label": "Boundary and contamination firewall",
      "description": "Rules, validators, or workflows that prevent generated candidates, retrieved context, or external assets from overriding source authority.",
      "leverage": "very_high",
      "recognition_mode": "repository_composite",
      "positive_signals": [
        "authority boundary language",
        "candidate-only or source-owned trust zones",
        "prompt-injection or contamination defenses",
        "human gate or quarantine rules"
      ],
      "missing_evidence": [
        "attack/failure tests",
        "bypass policy",
        "reviewed enforcement boundary"
      ]
    },
    {
      "id": "proposal_promotion_workflow",
      "label": "Proposal-to-promotion workflow",
      "description": "Candidate proposals, review gates, promotion logs, validators, and rollback paths that turn observations into reviewed changes only after human approval.",
      "leverage": "very_high",
      "recognition_mode": "repository_composite",
      "positive_signals": [
        "proposal records",
        "promotion decisions",
        "human review gates",
        "validator or registry update path"
      ],
      "missing_evidence": [
        "reviewed promotion examples",
        "rollback or rejection examples",
        "source-authority boundary tests"
      ]
    },
    {
      "id": "load_bearing_decision_review_system",
      "label": "Load-bearing decision review system",
      "description": "A governed workflow that classifies high-impact software, roadmap, schema, scoring, governance, dependency, and automation decisions by risk tier before they shape downstream repos or future agents.",
      "leverage": "very_high",
      "recognition_mode": "repository_composite",
      "positive_signals": [
        "load-bearing decision or risk-tier language",
        "fresh-eyes red-team or premortem review template",
        "rollback, kill criteria, and bounded A/B comparison language",
        "reviewed learning rule surfaced by preflight or midflight",
        "tests or governance checks that prevent silent bypass"
      ],
      "missing_evidence": [
        "reviewed examples across multiple repos",
        "measured reduction in downstream rework or false-positive defaults",
        "fresh-eyes review records for the highest-risk decisions",
        "human-reviewed threshold for when ceremony becomes too heavy"
      ]
    },
    {
      "id": "frontier_signal_intake_loop",
      "label": "Frontier signal intake loop",
      "description": "Research, literature, watch items, external signals, and review gates that surface new ideas without automatically importing them as truth.",
      "leverage": "high",
      "recognition_mode": "repository_composite",
      "positive_signals": [
        "research radar assets",
        "frontier or literature watch language",
        "source provenance fields",
        "license and review gates"
      ],
      "missing_evidence": [
        "source terms review",
        "false-positive review",
        "human-curated adoption decision"
      ]
    },
    {
      "id": "gold_review_packet_system",
      "label": "Gold set and review packet system",
      "description": "Gold cases, expected outputs, review packets, labels, and scoring rubrics that make future evaluation and calibration repeatable.",
      "leverage": "very_high",
      "recognition_mode": "repository_composite",
      "positive_signals": [
        "gold or golden cases",
        "review packets",
        "labels or scorecards",
        "calibration or benchmark files"
      ],
      "missing_evidence": [
        "reviewed labels",
        "sampling rationale",
        "calibration history"
      ]
    },
    {
      "id": "duplicate_variant_preservation_system",
      "label": "Duplicate and variant preservation system",
      "description": "Exact identity, near-duplicate, variant, delta, and archive lineage evidence that preserves similar assets while making their differences reviewable.",
      "leverage": "high",
      "recognition_mode": "cluster",
      "positive_signals": [
        "duplicate or variant language",
        "delta records",
        "archive lineage",
        "chunk, shingle, fingerprint, or hash evidence"
      ],
      "missing_evidence": [
        "human-reviewed delta summary",
        "merge, variant, or supersession decision",
        "strength/weakness comparison"
      ]
    },
    {
      "id": "model_algorithm_system",
      "label": "Model, algorithm, or forecasting system",
      "description": "Algorithms, scoring models, forecasters, simulations, optimization models, or frontier math assets paired with tests/data.",